Serial No.,Title,Purpose,Furnishing,Type,Price(Currency),Price,Price(Frequency),Bedrooms,Bathrooms,Area(Sqft),Location,Area,city,country,Amenities,Description,DED,Reference ID,BLN,Agent Name,Agent Email,Agent Phone Number,Agent Whatsapp No.,Agency Name,Agency Email,Property Profile Link(Dubizzle),Image Links
3,SPACIOUS VILLA | MODERN DESIGN | MAID ROOM |GARDEN,Rent,Unfurnished,Villa,AED,"300,000",Yearly,5 beds,6 baths,"12,002 sqft","Umm Nahad 3, Dubailand, Dubai, UAE",Umm Nahad 3,Dubailand,Dubai,Maids Room|Central A/C & Heating|Private Garden|Pets Allowed|Laundry Room|Kids Play Area|Storage Areas|Barbeque Area,"<strong>Gems Luxurious Properties </strong>is pleased to offer 5 bedrooms independent&nbsp;villa in Umm Nahad 3, Dubai.<br><br><strong>Property Features:</strong><br><strong> *</strong>&nbsp;Ready to move, fully Independent villa with huge sized.<br><strong> *&nbsp;</strong>Spacious 5 Bedrooms Ensuite.<br><strong>*</strong>&nbsp;All Bedrooms are powerful interior&nbsp;designs with high quality Fixtures.<br><strong>*</strong>&nbsp;Bright and airy Hallway.<br><strong>*</strong>&nbsp;Huge Living room with powder room.<br><strong>*</strong>&nbsp;Modern Fitted kitchen.<br><strong>*</strong>&nbsp;Separate Dining Area.<br><strong>*</strong>&nbsp;TV lounge / living room available on first floor.<br><strong>*</strong>&nbsp;Maid room, Storage room.<br><strong>*</strong>&nbsp;Laundry room.<br><strong>*</strong>&nbsp;Covered Car Parking Area with Electric Gate.<br><strong>*&nbsp;</strong>Stunning Garden.<br><strong>*</strong>&nbsp;Close to schools, Restaurants &amp; Public transports.<br><strong>*</strong>&nbsp;Pets allowed.<br><br><strong>NOTE:&nbsp;Gems Luxurious Properties</strong> has all types of residential villas, commercial villas, townhouses and apartments all over Dubai.<br>- Call in confidence to our experienced property consultant who is ready to help you to find your dream house.<br><br><strong>GEMS LUXURIOUS PROPERTIES LLC (ORN # 24266 &amp; DED # 893476) </strong><br> Gems Luxurious Properties has been delivering sales and leases of luxurious residential, commercial, and leisure properties across Dubai.<br> Currently, we have more than 1,000 properties under its portfolio, which includes some of the luxurious residential &amp; commercial villas, warehouses, buildings, offices, labour camps, and apartments.<br>Website: <a href=""http://www.gemspropertiesllc.com/"" rel=""noopener noreferrer"" target=""_blank"">www.gemspropertiesllc.com</a><br>",893476,UMND-5B-0349PR,,Mohammed Akramuddin ,akram@gemspropertiesllc.com,+971559516288,+971559516288,Gems Luxurious Properties,imrankhan090189@gmail.com,https://uae.dubizzle.com/property-for-rent/residential/villahouse/2024/10/25/spacious-villa-modern-design-maid-room-gar-2-963/,https://dbz-images.dubizzle.com/images/2025/03/07/94cbccc2-3c23-4445-a88b-0098bc09034a/9444915c09a34848841c1fc57330d546-.jpg?impolicy=dpv    https://dbz-images.dubizzle.com/images/2025/03/07/94cbccc2-3c23-4445-a88b-0098bc09034a/ec6e1048c194452f8e2a927030f69c87-.jpg?impolicy=dpv    https://dbz-images.dubizzle.com/images/2025/03/07/94cbccc2-3c23-4445-a88b-0098bc09034a/bc7452e5795c46188e32eaedbb137aa4-.jpg?impolicy=dpv    https://dbz-images.dubizzle.com/images/2025/03/07/94cbccc2-3c23-4445-a88b-0098bc09034a/1aff200b61a64500a483d27112d20d89-.jpg?impolicy=dpv    https://dbz-images.dubizzle.com/images/2025/03/07/94cbccc2-3c23-4445-a88b-0098bc09034a/4456d84cb9fc402cab132f99aac0e225-.jpg?impolicy=dpv    https://dbz-images.dubizzle.com/images/2025/03/07/94cbccc2-3c23-4445-a88b-0098bc09034a/4378384219c04e0aa501d5bcd5184949-.jpg?impolicy=dpv    https://dbz-images.dubizzle.com/images/2025/03/07/94cbccc2-3c23-4445-a88b-0098bc09034a/e4e1d58b1ee4485d8ac2f94a9bf6916b-.jpg?impolicy=dpv    https://dbz-images.dubizzle.com/images/2025/03/07/94cbccc2-3c23-4445-a88b-0098bc09034a/f6e38596c2c24717a3956e8ce075089b-.jpg?impolicy=dpv    https://dbz-images.dubizzle.com/images/2025/03/07/94cbccc2-3c23-4445-a88b-0098bc09034a/508ba0aa4b744be49f64407a6093fd36-.jpg?impolicy=dpv    https://dbz-images.dubizzle.com/images/2025/03/07/94cbccc2-3c23-4445-a88b-0098bc09034a/f16dd6c164d24606aa8507113003b3f2-.jpg?impolicy=dpv    https://dbz-images.dubizzle.com/images/2025/03/07/94cbccc2-3c23-4445-a88b-0098bc09034a/bff02f018f3044609f5f069797f765c6-.jpg?impolicy=dpv    https://dbz-images.dubizzle.com/images/2025/03/07/94cbccc2-3c23-4445-a88b-0098bc09034a/fd034c1633634791b41ea9de41e4f7ee-.jpg?impolicy=dpv    https://dbz-images.dubizzle.com/images/2025/03/07/94cbccc2-3c23-4445-a88b-0098bc09034a/02ec059481aa44a7b5a437058bac1b09-.jpg?impolicy=dpv
4,Type 4M | Spacious Living | Vacant,Rent,Unfurnished,Villa,AED,"160,000",Yearly,2 beds,3 baths,"1,647 sqft","The Springs 15, The Springs, Dubai, UAE",The Springs 15,The Springs,Dubai,Study|Central A/C & Heating|Balcony|Private Garden|Security|Covered Parking,"Treo Homes is very pleased to be bringing to the market our latest listing in Springs 015, The Springs.<br><br>Features<br> - Type 4M<br> - 2 Bedrooms + Study<br> - Ideal family home<br> - Well Maintained<br> - Gated community<br> - Vacant<br> - Close to communal pool<br> - Gated Community<br> - Unfurnished<br> - 2 Parking spaces<br><br>The villa boasts from a Spacious living room along with 2 bathrooms with a landscaped garden. Step outside onto the private balcony and immerse yourself in the serene surroundings. 4M Springs 15, sets the standard for lakeside living<br><br>Being a gated community, Springs 15 is highly secured and the top choice for residence for locals as well as expatriates. Residents have access to community parks, a community pool, various retail shops, fine eateries, cafes, play areas, playgrounds, parks and fitness facilities. Also, notable educational institutions and healthcare centres are easily accessible.<br><br>To get more information or to book a viewing, get hold of us now.",790494,TREO-R-33337,,Hajar Nour ,hajar@treo-homes.com,+971559317600,+971509011498,Treo Real Estate Broker Owned by Nosheen Attai One Person Company L.L.C.,jake@treo-homes.com,https://uae.dubizzle.com/property-for-rent/residential/villahouse/2024/10/29/type-4m-spacious-living-vacant-2-949/,https://dbz-images.dubizzle.com/images/2025/02/27/a9a61312-d03e-4069-a66f-afbe399e4c57/2c32bd42f02f49c8b77d8977bdf2d332-.jpg?impolicy=dpv    https://dbz-images.dubizzle.com/images/2025/02/27/a9a61312-d03e-4069-a66f-afbe399e4c57/eb614034c5b7490592bb77f7b73ef44e-.jpg?impolicy=dpv    https://dbz-images.dubizzle.com/images/2025/02/27/a9a61312-d03e-4069-a66f-afbe399e4c57/92b156c47f5b416c9cfb31fe4212be64-.jpg?impolicy=dpv    https://dbz-images.dubizzle.com/images/2025/02/27/a9a61312-d03e-4069-a66f-afbe399e4c57/8ed3117d80324291a3e7c85769c7f554-.jpg?impolicy=dpv    https://dbz-images.dubizzle.com/images/2025/02/27/a9a61312-d03e-4069-a66f-afbe399e4c57/e7b13dafe98d4cba9a29e788576e0a06-.jpg?impolicy=dpv    https://dbz-images.dubizzle.com/images/2025/02/27/a9a61312-d03e-4069-a66f-afbe399e4c57/b136667934c9422f9d3ce5d84ccb78c6-.jpg?impolicy=dpv    https://dbz-images.dubizzle.com/images/2025/02/27/a9a61312-d03e-4069-a66f-afbe399e4c57/1beb2a905cc646aaa09f61f78660f726-.jpg?impolicy=dpv    https://dbz-images.dubizzle.com/images/2025/02/27/a9a61312-d03e-4069-a66f-afbe399e4c57/bc0f83c784314d06868e80c3332dfb9f-.jpg?impolicy=dpv    https://dbz-images.dubizzle.com/images/2025/02/27/a9a61312-d03e-4069-a66f-afbe399e4c57/f4fb6f0ba3fb486e92d7ddf8ac5d64c9-.jpg?impolicy=dpv    https://dbz-images.dubizzle.com/images/2025/02/27/a9a61312-d03e-4069-a66f-afbe399e4c57/c9a52eec853143c3a1d32587a3b6ba28-.jpg?impolicy=dpv    https://dbz-images.dubizzle.com/images/2025/02/27/a9a61312-d03e-4069-a66f-afbe399e4c57/8ccf27afa6d24139a70cac9aa59c6fba-.jpg?impolicy=dpv
5,Prime Location | Lake Views | Vacant Now,Rent,Unfurnished,Villa,AED,"500,000",Yearly,5 beds,6 baths,"4,689 sqft","Legacy, Jumeirah Park, Dubai, UAE",Legacy,Jumeirah Park,Dubai,Study|Central A/C & Heating|Balcony|Private Garden|Shared Pool|Covered Parking|Pets Allowed,"Sam Biggerstaff from Treo Homes is very pleased to bring to the market this latest Legacy listing in, Jumeirah Park.<br><br>Features<br> - Over Looking Jumeirah Islands<br> - 5 Bedrooms + Maids Room<br> - Private Swimming Pool<br> - 6 Bathrooms + Study<br> - Excellent Condition<br> - Well Maintained<br> - Prime Location<br> - Available Now<br> - BUA 4,689 SQFT<br> - PLOT 7,213 SQFT<br><br>This vacant 5 bedroom villa has a combined open plan living, dining and closed kitchen which is finished in light oak wooden interior colour which is connecting maid rooms.<br><br>There are 5 bedrooms inside the property, one downstairs and 4 upstairs. All bedrooms have their own ensuite bathroom and built in wardrobes. This villa is in excellent condition, ideal for a family looking a well sought after villa.<br><br>The villa has beautiful lake views overlooking Jumeirah Islands, allowing for peaceful living in the District 2 area. Also including temperature controlled swimming pool.<br><br>This villa will be vacant mid November.<br><br>5% Security Deposit <br><br>5% Broker Fee<br><br>To get more information or to book a viewing, contact Sam.",790494,TREO-R-33715,,Samuel Biggerstaff ,samuel@treo-homes.com,+971585897455,+971509011498,Treo Real Estate Broker Owned by Nosheen Attai One Person Company L.L.C.,jake@treo-homes.com,https://uae.dubizzle.com/property-for-rent/residential/villahouse/2024/11/12/prime-location-lake-views-vacant-now-2-594/,https://dbz-images.dubizzle.com/images/2025/02/28/47f9c8c8-202f-4a1c-b7ac-fc4a44d4a918/557fbf2a495b42f08876c3c78133b715-.jpg?impolicy=dpv    https://dbz-images.dubizzle.com/images/2025/02/28/47f9c8c8-202f-4a1c-b7ac-fc4a44d4a918/595a7dc7384749eda32e568e369992dc-.jpg?impolicy=dpv    https://dbz-images.dubizzle.com/images/2025/02/28/47f9c8c8-202f-4a1c-b7ac-fc4a44d4a918/71e735ab0ae142d1aab33b40bea7191a-.jpg?impolicy=dpv    https://dbz-images.dubizzle.com/images/2025/02/28/47f9c8c8-202f-4a1c-b7ac-fc4a44d4a918/6cd8483e86044da3ba37cc04be9d6fbf-.jpg?impolicy=dpv    https://dbz-images.dubizzle.com/images/2025/02/28/47f9c8c8-202f-4a1c-b7ac-fc4a44d4a918/46abf9d5efa54d86b3b66bee4bc435e9-.jpg?impolicy=dpv    https://dbz-images.dubizzle.com/images/2025/02/28/47f9c8c8-202f-4a1c-b7ac-fc4a44d4a918/f8f151b83d58426f95d970a5e5bb609f-.jpg?impolicy=dpv    https://dbz-images.dubizzle.com/images/2025/02/28/47f9c8c8-202f-4a1c-b7ac-fc4a44d4a918/66547f8ce9c14a9eb366a0d634eaa6e6-.jpg?impolicy=dpv    https://dbz-images.dubizzle.com/images/2025/02/28/47f9c8c8-202f-4a1c-b7ac-fc4a44d4a918/168d9bfeb6f94487a379589bc61ceb7c-.jpg?impolicy=dpv    https://dbz-images.dubizzle.com/images/2025/02/28/47f9c8c8-202f-4a1c-b7ac-fc4a44d4a918/8a576102ba7647fdb5ca7c422e6f9eb2-.jpg?impolicy=dpv    https://dbz-images.dubizzle.com/images/2025/02/28/47f9c8c8-202f-4a1c-b7ac-fc4a44d4a918/6f2cb8f645ec4338b51b720a75ef9b3f-.jpg?impolicy=dpv    https://dbz-images.dubizzle.com/images/2025/02/28/47f9c8c8-202f-4a1c-b7ac-fc4a44d4a918/39d653c072624a3ea5a8db37ddbf3325-.jpg?impolicy=dpv    https://dbz-images.dubizzle.com/images/2025/02/28/47f9c8c8-202f-4a1c-b7ac-fc4a44d4a918/19a118da0ec546e48da277816c632a93-.jpg?impolicy=dpv
6,Internal Location | 5 Bed | Private Pool,Rent,Unfurnished,Villa,AED,"500,000",Yearly,5 beds,6 baths,"4,689 sqft","Legacy, Jumeirah Park, Dubai, UAE",Legacy,Jumeirah Park,Dubai,Central A/C & Heating|Balcony|Private Garden|Shared Pool|Covered Parking,"Sam Biggerstaff from Treo Homes is very pleased to bring to the market this latest Legacy listing in, Jumeirah Park.<br><br>Features<br> - 5 Bedrooms + Maids Room<br> - Private Spacious Garden<br> - Open Plan Living Space<br> - Chiller Swimming Pool<br> - 6 Bathrooms + Study<br> - Well Maintained<br> - Prime Location<br> - Available Now<br> - BUA 4,689 SQFT<br> - PLOT 8,588 SQFT<br><br>This vacant 5 bedroom villa has a combined open plan living, dining and kitchen which is finished in dark oak wooden interior colour which is connecting maid rooms.<br><br>There are 5 bedrooms inside the property, one downstairs and 4 upstairs. All bedrooms have their own ensuite bedroom and built in wardrobes. This villa is in pristine condition, ideal for a family looking a modern villa in the perfect location.<br><br>The villa is situated in a quiet location within District 2 allowing for peaceful living, also including a fully landscaped garden with modern upgraded swimming pool.<br><br>This villa is vacant now, ready to move in.<br><br>To get more information or to book a viewing, contact Sam.",790494,TREO-R-33761,,Samuel Biggerstaff ,samuel@treo-homes.com,+971585897455,+971509011498,Treo Real Estate Broker Owned by Nosheen Attai One Person Company L.L.C.,jake@treo-homes.com,https://uae.dubizzle.com/property-for-rent/residential/villahouse/2024/11/13/internal-location-5-bed-private-pool-2-959/,https://dbz-images.dubizzle.com/images/2025/02/26/2349c480-c803-45aa-80ca-ee6a86f0813e/4b8a362c213f40048d6729f9493747e4-.jpg?impolicy=dpv    https://dbz-images.dubizzle.com/images/2025/02/26/2349c480-c803-45aa-80ca-ee6a86f0813e/c37c2f42b88a4051ab920ea10d02a4b5-.jpg?impolicy=dpv    https://dbz-images.dubizzle.com/images/2025/02/26/2349c480-c803-45aa-80ca-ee6a86f0813e/45d81dee74da4509b752c0dce4f1bb44-.jpg?impolicy=dpv    https://dbz-images.dubizzle.com/images/2025/02/26/2349c480-c803-45aa-80ca-ee6a86f0813e/0860ab1f2c1c43a4b3a06c5897b37ad7-.jpg?impolicy=dpv    https://dbz-images.dubizzle.com/images/2025/02/26/2349c480-c803-45aa-80ca-ee6a86f0813e/415bff941c4946b481482bdd0f737b45-.jpg?impolicy=dpv    https://dbz-images.dubizzle.com/images/2025/02/26/2349c480-c803-45aa-80ca-ee6a86f0813e/b56bf6308e2042808aa0615fe1d62152-.jpg?impolicy=dpv    https://dbz-images.dubizzle.com/images/2025/02/26/2349c480-c803-45aa-80ca-ee6a86f0813e/49b583235c3b44d2b799b27afce24654-.jpg?impolicy=dpv    https://dbz-images.dubizzle.com/images/2025/02/26/2349c480-c803-45aa-80ca-ee6a86f0813e/81ee556c7a4d409ab3c38c4116c360ef-.jpg?impolicy=dpv    https://dbz-images.dubizzle.com/images/2025/02/26/2349c480-c803-45aa-80ca-ee6a86f0813e/e28a0cad18f24d2cb0d678867c765b2d-.jpg?impolicy=dpv    https://dbz-images.dubizzle.com/images/2025/02/26/2349c480-c803-45aa-80ca-ee6a86f0813e/b1ea428526804a249b8f34787f56cfd6-.jpg?impolicy=dpv    https://dbz-images.dubizzle.com/images/2025/02/26/2349c480-c803-45aa-80ca-ee6a86f0813e/d71fd22a18cb4c98abff7393119f54e4-.jpg?impolicy=dpv    https://dbz-images.dubizzle.com/images/2025/02/26/2349c480-c803-45aa-80ca-ee6a86f0813e/f5584a4d83bb4f879afa0341df5b5f87-.jpg?impolicy=dpv    https://dbz-images.dubizzle.com/images/2025/02/26/2349c480-c803-45aa-80ca-ee6a86f0813e/0ae83649fb9e4933ad73f8e6664feddb-.jpg?impolicy=dpv    https://dbz-images.dubizzle.com/images/2025/02/26/2349c480-c803-45aa-80ca-ee6a86f0813e/db4f7a527ee147a884bc4860f47a78a7-.jpg?impolicy=dpv    https://dbz-images.dubizzle.com/images/2025/02/26/2349c480-c803-45aa-80ca-ee6a86f0813e/b2e181bf30ab4269bb0127cf9d05da08-.jpg?impolicy=dpv
7,Prime Location | D4 | Pool | December,Rent,Unfurnished,Villa,AED,"480,000",Yearly,4 beds,5 baths,"4,335 sqft","Legacy, Jumeirah Park, Dubai, UAE",Legacy,Jumeirah Park,Dubai,Study|Central A/C & Heating|Balcony|Private Garden|Shared Pool|Covered Parking|Pets Allowed,"Sam Biggerstaff from Treo Homes is very pleased to be bringing to the market our latest listing in Legacy, Jumeirah Park.<br><br>Features<br> - 4 Bedrooms + Maids Room + Study<br> - 5 Bathrooms + Family Room<br> - Private Swimming Pool<br> - Immaculate Condition<br> - Amazing Location<br> - Well Maintained<br> - Great Landlord<br> - Available Soon<br> - BUA 4,335 SQFT<br> - PLOT 8,028 SQFT<br><br>This 4 bedroom Large villa has a combined open plan living, dining and kitchen which is finished in dark oak wooden interior colour which is connecting maid rooms.<br><br>There are 4 bedrooms inside the property, one downstairs and 3 upstairs. All bedrooms have their own ensuite bedroom and built in wardrobes. This villa is in pristine condition, ideal for a family looking a modern villa in the perfect location.<br><br>The villa is situated in a quiet location within District 4 allowing for peaceful living, also including a fully landscaped garden and temperature controlled swimming pool.<br><br>This villa will be vacant mid December.<br><br>To get more information or to book a viewing, contact Sam.",790494,TREO-R-33513,,Samuel Biggerstaff ,samuel@treo-homes.com,+971585897455,+971509011498,Treo Real Estate Broker Owned by Nosheen Attai One Person Company L.L.C.,jake@treo-homes.com,https://uae.dubizzle.com/property-for-rent/residential/villahouse/2024/11/4/prime-location-d4-pool-december-2-857/,https://dbz-images.dubizzle.com/images/2025/02/26/83dcc331-d4af-44cd-af61-5e1e6f54791d/b75cd4070c0548638cdf08ab0522c6e1-.jpg?impolicy=dpv    https://dbz-images.dubizzle.com/images/2025/02/26/83dcc331-d4af-44cd-af61-5e1e6f54791d/b46195663a0442188769736cf30c1dbb-.jpg?impolicy=dpv    https://dbz-images.dubizzle.com/images/2025/02/26/83dcc331-d4af-44cd-af61-5e1e6f54791d/b57da92483014c95b6b713b451a74bec-.jpg?impolicy=dpv    https://dbz-images.dubizzle.com/images/2025/02/26/83dcc331-d4af-44cd-af61-5e1e6f54791d/a0cdcd597215474d93acc570ead72ab7-.jpg?impolicy=dpv    https://dbz-images.dubizzle.com/images/2025/02/26/83dcc331-d4af-44cd-af61-5e1e6f54791d/93bfe39822cb42e0b33d4bfc08a7819e-.jpg?impolicy=dpv    https://dbz-images.dubizzle.com/images/2025/02/26/83dcc331-d4af-44cd-af61-5e1e6f54791d/a6ef6adbae7a44e8984a1ba3396ce184-.jpg?impolicy=dpv    https://dbz-images.dubizzle.com/images/2025/02/26/83dcc331-d4af-44cd-af61-5e1e6f54791d/6d8a59ff4ba5411eb2e98520f35070fd-.jpg?impolicy=dpv    https://dbz-images.dubizzle.com/images/2025/02/26/83dcc331-d4af-44cd-af61-5e1e6f54791d/50830de4f2d64c45ac4037f50dd2ad04-.jpg?impolicy=dpv    https://dbz-images.dubizzle.com/images/2025/02/26/83dcc331-d4af-44cd-af61-5e1e6f54791d/68741f5734774ed7a7e1b8c1767a51bc-.jpg?impolicy=dpv    https://dbz-images.dubizzle.com/images/2025/02/26/83dcc331-d4af-44cd-af61-5e1e6f54791d/d7a848f47d1746c7a1552b7310d1141c-.jpg?impolicy=dpv    https://dbz-images.dubizzle.com/images/2025/02/26/83dcc331-d4af-44cd-af61-5e1e6f54791d/27d42d215c4d4a0cbf0f614e3c928d10-.jpg?impolicy=dpv    https://dbz-images.dubizzle.com/images/2025/02/26/83dcc331-d4af-44cd-af61-5e1e6f54791d/024cfa30f58b48aabdc586bc20729e31-.jpg?impolicy=dpv    https://dbz-images.dubizzle.com/images/2025/02/26/83dcc331-d4af-44cd-af61-5e1e6f54791d/84ee7c5e90f94f29bdb965ecff2b7ae9-.jpg?impolicy=dpv
8,Single Row | Ready to Move | Ready Garden,Rent,Unfurnished,Villa,AED,"290,000",Yearly,4 beds,4 baths,"2,406 sqft","Maple 2, Maple, Dubai Hills Estate, Dubai, UAE",Maple 2,Maple,Dubai Hills Estate,Maids Room|Study|Central A/C & Heating|Balcony|Private Garden|Private Gym|Shared Pool|Security|Covered Parking|View of Water|Double Glazed Windows|Day Care Center|First Aid Medical Center|Laundry Room|Broadband Internet|Intercom|Kids Play Area|CCTV Security|Cafeteria or Canteen|Facilities for Disabled|Storage Areas|Barbeque Area|Waste Disposal,"Nestled in the lush greenery of Dubai Hills Estate, this contemporary single-row villa in the Maple 2 community offers the ultimate in modern living.&nbsp;<br><br>Positioned in one of the most desirable locations within Emaar’s prestigious master development, the villa boasts scenic views of landscaped gardens and the vibrant community around it.<br><br>Inside, the villa’s layout maximizes natural light with an open-plan design that seamlessly connects the living and dining areas.&nbsp;<br><br>The stylish open kitchen, complete with ample cabinets and a large countertop, flows into the dining space, making it ideal for entertaining.&nbsp;<br><br>The spacious living room opens to a private, beautifully manicured garden, creating a tranquil outdoor retreat.&nbsp;<br><br>The ground floor also features a guest bedroom and an en-suite maid's room for added convenience.<br><br>On the first floor, the master bedroom serves as a private haven, featuring a walk-in closet, an en-suite bathroom, and access to a balcony with panoramic views of the green surroundings.&nbsp;<br><br>Two additional bedrooms share a well-appointed bathroom.<br><br>This villa spans 2,406 square feet. Villa is available for rent and ready to move.<br><br>For viewings and inquiries, please contact Naveed +971559978609<br>",1085794,Map_4bed,,Syed Naveed Anjum ,naveed@profoundrealtors.com,+971559978609,+971559978609,Profound Realtors Real Estate,sana@profoundrealtors.com,https://uae.dubizzle.com/property-for-rent/residential/villahouse/2024/11/5/single-row-perfect-location-modern-eleganc-2-721/,https://dbz-images.dubizzle.com/images/2025/03/11/3f639068-c1f7-4114-a2fd-b2388499a229/d5238175a8e743dc991f700c8e62881c-.jpg?impolicy=dpv    https://dbz-images.dubizzle.com/images/2025/03/11/3f639068-c1f7-4114-a2fd-b2388499a229/9c69f828bb244579a225bfc93b81a713-.jpg?impolicy=dpv    https://dbz-images.dubizzle.com/images/2025/03/11/3f639068-c1f7-4114-a2fd-b2388499a229/724d391a8d544db5aff8106c5cf26e26-.jpg?impolicy=dpv    https://dbz-images.dubizzle.com/images/2025/03/11/3f639068-c1f7-4114-a2fd-b2388499a229/ab7d40625c784774b81f01591e0716f1-.jpg?impolicy=dpv    https://dbz-images.dubizzle.com/images/2025/03/11/3f639068-c1f7-4114-a2fd-b2388499a229/76034efede1a45fab12d78ea4689724c-.jpg?impolicy=dpv    https://dbz-images.dubizzle.com/images/2025/03/11/3f639068-c1f7-4114-a2fd-b2388499a229/d3ee4184e1f54e98b93da030cdfa6213-.jpg?impolicy=dpv    https://dbz-images.dubizzle.com/images/2025/03/11/3f639068-c1f7-4114-a2fd-b2388499a229/0c2d04e540f24622b3c5369b7efb1824-.jpg?impolicy=dpv    https://dbz-images.dubizzle.com/images/2025/03/11/3f639068-c1f7-4114-a2fd-b2388499a229/0517f1d2a4c2454ca59ce64e7ac309db-.jpg?impolicy=dpv    https://dbz-images.dubizzle.com/images/2025/03/11/3f639068-c1f7-4114-a2fd-b2388499a229/ff334af165a2403a9e234802e24041ce-.jpg?impolicy=dpv    https://dbz-images.dubizzle.com/images/2025/03/11/3f639068-c1f7-4114-a2fd-b2388499a229/c4d3d68b5b474b5bb75ad4c48d912804-.jpg?impolicy=dpv    https://dbz-images.dubizzle.com/images/2025/03/11/3f639068-c1f7-4114-a2fd-b2388499a229/1abae2d6e8fe49eb930fbed9ca4f16c8-.jpg?impolicy=dpv    https://dbz-images.dubizzle.com/images/2025/03/11/3f639068-c1f7-4114-a2fd-b2388499a229/4b251ea789be4910b01db6a12ed3c973-.jpg?impolicy=dpv    https://dbz-images.dubizzle.com/images/2025/03/11/3f639068-c1f7-4114-a2fd-b2388499a229/09dcba769eb84abebf7ae6484f051cd9-.jpg?impolicy=dpv    https://dbz-images.dubizzle.com/images/2025/03/11/3f639068-c1f7-4114-a2fd-b2388499a229/7ca3993f07e844ce9c93f5469391c2fc-.jpg?impolicy=dpv    https://dbz-images.dubizzle.com/images/2025/03/11/3f639068-c1f7-4114-a2fd-b2388499a229/b3945bdc782a457c9c9bd003c0d9497d-.jpg?impolicy=dpv    https://dbz-images.dubizzle.com/images/2025/03/11/3f639068-c1f7-4114-a2fd-b2388499a229/9b0d796e4482487e91d1e39175cfb2d5-.jpg?impolicy=dpv    https://dbz-images.dubizzle.com/images/2025/03/11/3f639068-c1f7-4114-a2fd-b2388499a229/93d15ed7ab6d43a7b4e9aad170b4939c-.jpg?impolicy=dpv    https://dbz-images.dubizzle.com/images/2025/03/11/3f639068-c1f7-4114-a2fd-b2388499a229/ce1b43b92f8d4756a9b1a9433146ad00-.jpg?impolicy=dpv    https://dbz-images.dubizzle.com/images/2025/03/11/3f639068-c1f7-4114-a2fd-b2388499a229/4fad229ffb7a4ccebfb1ea39c0460b9e-.jpg?impolicy=dpv    https://dbz-images.dubizzle.com/images/2025/03/11/3f639068-c1f7-4114-a2fd-b2388499a229/a01dbd1682284dd183f60a0e09bcae78-.jpg?impolicy=dpv    https://dbz-images.dubizzle.com/images/2025/03/11/3f639068-c1f7-4114-a2fd-b2388499a229/2ed21a01ea5e48538fecd52e8925abb2-.jpg?impolicy=dpv    https://dbz-images.dubizzle.com/images/2025/03/11/3f639068-c1f7-4114-a2fd-b2388499a229/9376151f294549b3b5d07a8a45f78a85-.jpg?impolicy=dpv    https://dbz-images.dubizzle.com/images/2025/03/11/3f639068-c1f7-4114-a2fd-b2388499a229/1eb8408f2e2f438891f520af0afd038c-.jpg?impolicy=dpv    https://dbz-images.dubizzle.com/images/2025/03/11/3f639068-c1f7-4114-a2fd-b2388499a229/568af1b9ac6f47d8bfb26c56fd22f034-.jpg?impolicy=dpv    https://dbz-images.dubizzle.com/images/2025/03/11/3f639068-c1f7-4114-a2fd-b2388499a229/55d77cfbf39543ce8970ef022cb92322-.jpg?impolicy=dpv    https://dbz-images.dubizzle.com/images/2025/03/11/3f639068-c1f7-4114-a2fd-b2388499a229/5d2def999e9f4ac3b7c1cf3724885975-.jpg?impolicy=dpv    https://dbz-images.dubizzle.com/images/2025/03/11/3f639068-c1f7-4114-a2fd-b2388499a229/88f747186e6e47778de6600c55aa2d8c-.jpg?impolicy=dpv
